{
  "schema_version": "lorq.cell-judgement.v1alpha1",
  "contract_version": "lorq.contract.v1alpha1",
  "judgement_name": "judge-primary",
  "cell_id": "no-final-answer__graphify__attempt-001",
  "case_id": "no-final-answer",
  "mode_id": "graphify",
  "attempt_id": "attempt-001",
  "cell_status": "invalid_artifact",
  "status": "judged",
  "source": {
    "backend": "deterministic-fake",
    "fixture_schema_version": "lorq.fake-judge-fixture.v1alpha1",
    "fixture_file": "fake-judge.yaml",
    "fixture_key": "no-final-answer|graphify|1",
    "real_llm_used": false
  },
  "quality": {
    "ok": true,
    "overall_score": 1.0,
    "confidence": "high",
    "dimensions": {
      "correctness": {
        "score": 1,
        "rationale": "Fixture score is deterministic."
      },
      "completeness": {
        "score": 1,
        "rationale": "Fixture coverage is predefined."
      },
      "evidence": {
        "score": 1,
        "rationale": "Evidence is present only when final answer is present."
      }
    },
    "strengths": [],
    "weaknesses": [
      "missing final answer"
    ],
    "missing_or_questionable": [
      "final answer"
    ],
    "summary": "The answer is intentionally missing; this judgement records low quality without using an LLM."
  },
  "input_refs": {
    "cell_result": "runs/shard-002/cells/no-final-answer__graphify__attempt-001/cell_result.json",
    "cell_dir": "runs/shard-002/cells/no-final-answer__graphify__attempt-001",
    "final_answer": "runs/shard-002/cells/no-final-answer__graphify__attempt-001/answer.md",
    "validation": "runs/shard-002/cells/no-final-answer__graphify__attempt-001/validation.json",
    "trace": "runs/shard-002/cells/no-final-answer__graphify__attempt-001/events.normalized.jsonl"
  }
}
